{
  "$schema": "./schemas/repository-v2.schema.json",
  "schemaVersion": 2,
  "name": "UNuse",
  "sourceUrl": "https://github.com/TouristH/UNuse",
  "launcherUrl": "https://github.com/redstore-noob/NyaLauncher",
  "indexPath": "public/v1/index.json",
  "indexV2Path": "public/v2/index.json",
  "v2MinimumLauncherVersion": "1.0.0-preview1",
  "registryBotLogin": "nyalauncher-registry-bot[bot]",
  "trustedReviewers": [
    "TouristH",
    "redstore-noob"
  ],
  "trustedReviewerIds": {
    "TouristH": 143396778,
    "redstore-noob": 206107690
  }
}
